{
  "schema_version": "0.1.0",
  "benchmark_id": "bench-0001-synthetic",
  "model_name": "example-tts-model",
  "model_version": "0.0.1",
  "created_at": "2026-01-01T00:00:00Z",
  "status": "planned",
  "hardware": { "cpu": "example-cpu", "gpu": null },
  "metrics": {},
  "notes": "SYNTHETIC example record. No real benchmark has been run in Phase 0 (see docs/BENCHMARKING.md)."
}
